{"tag":"Research Project","title":"Hasil Survei Kebiasaan Belanja Online Mahasiswa","subtitle":"Analisis Perilaku Konsumen Generasi Z","footer":{"slogan":"Tindak Lanjut untuk Peningkatan Layanan","text":""},"sections":[ {"type":"text","title":"Research Overview","text":"Survei ini bertujuan untuk memahami kebiasaan belanja online mahasiswa di Medan. Data dikumpulkan melalui survei online, wawancara mendalam, dan analisis riwayat transaksi dari 350 responden yang mewakili 500 mahasiswa yang diundang."}, {"type":"bullets","title":"Objectives","items":[{"title":"Memahami frekuensi belanja online","text":"72% mahasiswa belanja online minimal sebulan sekali."}, {"title":"Mengidentifikasi faktor pendorong","text":"Harga, kemudahan, dan pilihan produk adalah alasan utama."}, {"title":"Menganalisis metode pembayaran","text":"Sebagian besar menggunakan e-wallet dan paylater."}]}, {"type":"facts","title":"Target Audience","items":[{"label":"Age range","value":"18-24 tahun"},{"label":"Location","value":"5 kampus di Medan"},{"label":"Sample size","value":"350 mahasiswa (dari 500 yang diundang)"}],"pictograph":{"value":350,"total":500,"label":"Responden"}}, {"type":"bullets","title":"Research Methods","items":[{"title":"Online survey","text":"24 pertanyaan untuk mengumpulkan data kuantitatif."}, {"title":"Interviews","text":"12 wawancara mendalam untuk pemahaman kualitatif."}]}, {"type":"stats","title":"Key Findings","items":[{"label":"Belanja Online","value":"72%","text":"Mahasiswa belanja online minimal sebulan sekali."}, {"label":"Alasan Utama","value":"54%","text":"Harga adalah alasan utama belanja online."}, {"label":"Rata-rata Belanja","value":"310000","text":"Rata-rata pengeluaran bulanan mahasiswa Rp 310.000."}]}, {"type":"chart","title":"Customer Insights","chart":{"type":"donut","categories":["Harga","Kemudahan","Pilihan Produk"],"series":[{"name":"Harga","values":[54,31,15]}]},"text":"Faktor utama yang mendorong mahasiswa untuk berbelanja online adalah harga, kemudahan, dan variasi produk yang tersedia.","quote":"Prioritaskan harga dan kenyamanan saat berbelanja secara online."}, {"type":"bullets","title":"Market Trends","items":[{"title":"Live Streaming Shopping","text":"Belanja lewat live streaming naik dari 12% (2024) menjadi 29% (2026)."}, {"title":"PayLater Usage","text":"23% mahasiswa menggunakan layanan paylater."}]}
] }